{
  "schema_version": "1.0.0",
  "regulation_id": "M-B",
  "revision": "official-2026-06-17",
  "title": "レギュレーションM-B（2026-07-13確認）",
  "status": "current",
  "verification_status": "partially_verified",
  "published_at": null,
  "period": {
    "start_date": "2026-06-17",
    "end_at": "2026-09-02T10:59:00+09:00",
    "timezone": "Asia/Tokyo"
  },
  "battle_format": "singles_3v3",
  "team_size": 3,
  "level": 50,
  "item_clause": {
    "held_items_enabled": true,
    "duplicate_held_items_allowed": false
  },
  "battle_timer": {
    "total_minutes": 20,
    "player_minutes": 7,
    "turn_seconds": 45,
    "selection_seconds": 90
  },
  "required_mechanics": [
    "mega_evolution"
  ],
  "source_manifest_ids": [
    "pokemon-home-regulation-m-b-current"
  ]
}
